{
  "schema": "agent_control_plan_v1",
  "version": 1,
  "workload_plan_digest": "afc9cc56e7bed3228009e27e99b42cff882cdf580430f47a4016c786c6113e5e",
  "actions": [
    {
      "control_ordinal": 1,
      "opcode": "CANCEL",
      "trigger": {
        "kind": "AFTER_SQ_ACCEPT",
        "event_user_id": 0,
        "event_task_seq": 0,
        "event_repair_round": 1
      },
      "issuer_user_id": 0,
      "issuer_task_seq": 0,
      "target_user_id": 0,
      "target_task_seq": 0,
      "target_repair_round": 1
    },
    {
      "control_ordinal": 2,
      "opcode": "RELEASE_SESSION",
      "trigger": {
        "kind": "SCENARIO_START"
      },
      "issuer_user_id": 1,
      "issuer_task_seq": 0,
      "target_session_id": 999,
      "target_kv_handle": 999,
      "target_generation": 1
    }
  ]
}
